title,description,age_min,age_max,subject,activity_type,duration_minutes,emoji,benefit_explanation,instructions_for_parent,learning_objectives,materials_needed,safety_warnings,skills_improved,step_1_title,step_1_instruction,step_2_title,step_2_instruction,step_3_title,step_3_instruction
"Soft Pillow Push","Push a pillow across the room as fast as possible.",24,42,"motor","gross_motor",10,"💨","Strength + coordination + planning.","Use a clear floor lane.","Strength|Coordination|Planning","One big pillow","Clear floor of obstacles.","gross_motor|planning","Start line","Put pillow at the start.","Push","Toddler pushes pillow to the other side.","Reset","Bring it back and try again."
"Eye Patch Pirate","Toddler wears a soft eye patch and walks like a pirate.",30,48,"art","play",10,"🏴‍☠️","Imagination + balance with reduced vision + giggles.","Use a soft fabric patch with a stretchy band.","Imagination|Balance|Humor","A soft fabric eye patch","Adult should stay close for balance.","creative|gross_motor","Put on patch","Place the patch gently over one eye.","Walk together","Hold hand and walk a few steps.","Off + on again","Take off and put back on with giggles."
"Whisper Game","Whisper a one-word message into the toddler's ear.",30,48,"language","game",5,"🤫","Listening + curiosity + connection.","Use very simple one-word messages.","Listening|Curiosity|Quiet voice","Just your voice","No safety concerns.","language|listening","Get close","Sit cheek-to-cheek with the toddler.","Whisper a word","Whisper 'banana' or another fun word.","Toddler repeats","Wait for them to whisper it back; cheer."
"Wave to the Mirror","Greet yourself in a mirror — different waves each time.",24,42,"social","interactive",5,"👋","Self-recognition + body variety + joy.","Use a stable, mounted mirror.","Self-recognition|Body|Joy","A wall mirror","Mirror must be mounted securely.","social|gross_motor","Big wave","Wave high; cheer.","Tiny wave","Wave with just fingers.","Two-handed wave","Wave with both hands at once."
"Banana Roll","Roll a banana between the floor and palm.",24,42,"motor","game",5,"🍌","Hand-eye + texture + giggles.","Use a fresh whole banana; supervise mouth.","Hand-eye|Texture|Joy","A whole banana","Adult supervises eating.","fine_motor|sensory","Place banana","Lay a banana between you on the floor.","Roll back-and-forth","Roll it gently between palms.","Eat together","Peel and share when done."
"Quiet Cuddle","Sit close in silence for one minute.",18,42,"social","mindfulness",3,"🤗","Self-regulation + attachment.","No phones or screens. Just presence.","Calm|Attachment|Self-regulation","Just yourselves","No safety concerns.","emotional|attachment","Sit close","Sit on the couch or floor together.","Breathe","Take slow breaths; close your eyes.","Whisper a word","End by whispering 'I love you' to the toddler."
"Spoon Tap Beat","Tap two metal spoons together to a slow beat.",24,42,"art","vocal",5,"🥄","Rhythm + cause-effect + sound.","Use spoons that aren't loud enough to startle.","Rhythm|Cause-effect|Joy","2 metal teaspoons","Stay close; supervise mouth.","rhythm|fine_motor","Hand spoons","Give the toddler one spoon, keep one.","Slow tap","Tap yours; they tap theirs.","Faster tap","Speed up; slow down; giggle."
